{
  "id": "PHASE-1-1-1",
  "type": "test",
  "title": "运行最小验证命令",
  "priority": "high",
  "phase": 1,
  "dependencies": [],
  "docs_to_read": [
    "docs/plans/spec.md",
    "docs/plans/tasks.md"
  ],
  "spec": {
    "description": "验证 task-decomposer 在最小示例项目中能够正确读取任务、执行验证命令并完成任务状态流转。",
    "files": [
      "docs/tasks/PHASE-1-1-1.json"
    ],
    "context": [
      "docs/plans/spec.md"
    ]
  },
  "acceptance_criteria": [
    "task show 能显示任务详情",
    "task test 能通过",
    "task complete 后任务状态为 completed"
  ],
  "implementation": {
    "steps": [
      {
        "step": "执行 task show 查看任务详情"
      },
      {
        "step": "执行 task test 验证命令"
      },
      {
        "step": "执行 task complete 标记完成"
      }
    ],
    "notes": ""
  },
  "validation": {
    "commands": [
      "python3 -c \"print('example task 1 passed')\""
    ],
    "manual_checks": []
  },
  "status": "pending"
}