{
  "id": "PHASE-1-1-2",
  "type": "test",
  "title": "验证依赖解锁后的完成流程",
  "priority": "medium",
  "phase": 1,
  "dependencies": [
    "PHASE-1-1-1"
  ],
  "docs_to_read": [
    "docs/plans/spec.md",
    "docs/plans/tasks.md"
  ],
  "spec": {
    "description": "验证存在依赖关系时，前置任务完成后当前任务能够进入 ready 状态，并可继续执行验证与完成流程。",
    "files": [
      "docs/tasks/PHASE-1-1-2.json"
    ],
    "context": [
      "docs/plans/tasks.md"
    ]
  },
  "acceptance_criteria": [
    "在 PHASE-1-1-1 完成前，该任务不会出现在 ready 列表中",
    "在 PHASE-1-1-1 完成后，该任务会出现在 ready 列表中",
    "task test 能通过"
  ],
  "implementation": {
    "steps": [
      { "step": "完成 PHASE-1-1-1" },
      { "step": "执行 task ready 确认该任务已解锁" },
      { "step": "执行 task test 与 task complete" }
    ],
    "notes": ""
  },
  "validation": {
    "commands": [
      "python3 -c \"print('example task 2 passed')\""
    ],
    "manual_checks": []
  },
  "status": "pending"
}
